{
  "entityid": "500123",
  "name": "Example Title",
  "logicalname": "example_value",
  "logicalcollectionname": "example_value",
  "collectionname": "example_value",
  "entitysetname": "example_value",
  "physicalname": "example_value",
  "basetablename": "example_value",
  "externalname": "example_value",
  "externalcollectionname": "example_value",
  "addresstablename": "example_value",
  "extensiontablename": "example_value",
  "reportviewname": "example_value",
  "parentcontrollingattributename": "example_value",
  "originallocalizedname": "example_value",
  "originallocalizedcollectionname": "example_value",
  "isactivity": true,
  "objecttypecode": 10,
  "componentstate": 10,
  "solutionid": "500123",
  "overwritetime": "example_value",
  "versionnumber": 10
}